year,title,link,DONE
1766,Ее императорского величества самодержицы всероссийской великой государыни императрицы Екатерины Алексеевны Регламент о управлении адмиралтейств и флотов. Ч. 1. Содержащая должности государственной адмиралтейств коллегии ее экспедиций и всех находящихся при адмиралтействе чинов,https://www.prlib.ru/item/1288550,0
1766,"Тариф о зборе пошлин в портовых и пограничных таможнях, с привозных и отвозных товаров",https://www.prlib.ru/item/372723,0
1766,Инструкция коннаго полку полковнику,https://www.prlib.ru/item/713553,0
1766,[Штат Главной провиантской канцелярии и ее конторы и ведомости провиантских магазинов.,https://www.prlib.ru/item/714580,0
1766,Инструкция всем магистратам данная в 1724 году из Главнаго магистрата,https://www.prlib.ru/item/413681,0
1766,"Наставление Правительствующаго сената из Межевой експедиции определенным к государственному земель размежеванию землемерам,",https://www.prlib.ru/item/713209,0
1766,Генеральное учреждение,https://www.prlib.ru/item/903506,0
1766,"Контракт постановленный в Правителствующем Сенате о содержании по силе именнаго ея императорскаго величества высочайшаго указа в Санктпетербурге и в Москве с подчиненными местами питейных и прочих нижеписанных зборов в компании надворному советнику Семену Федорову сыну Роговикову, коллежским ассессорам, Филипу Фадееву сыну Угримову, Александре Филипову сыну Угримову, и Димитрию Иванову сыну Папанелопулу, да к тому в прибавок, кто впредь от них в товарищество представлены будут, с будущаго 1767 года, впредь четыре года, то есть по 1771 й год, на нижеследующих кондициях",https://www.prlib.ru/item/713059,0
1766,"Древняя российская история от начала российскаго народа до кончины великаго князя Ярослава Перваго или до 1054 года,",https://www.prlib.ru/item/408112,0
1766,Воинский календарь на 1766 год,https://www.prlib.ru/item/714463,0
1766,Инструкция межевым губернским канцеляриям и провинциальным конторам.,https://www.prlib.ru/item/715088,0
1766,[Указ о проходе барок чрез Вышневолоцкие слюзы безостановочно],https://www.prlib.ru/item/394494,0
1766,Устав Императорскаго Шляхетнаго сухопутнаго кадетскаго корпуса,https://www.prlib.ru/item/714442,0
1766,Инструкция землемерам к генеральному всей Империи нашей земель размежеванию,https://www.prlib.ru/item/903564,0
1766,"Указ о начатии межевания в Московской губернии, и о приглашении владельцев к надлежащим по сему случаю с их стороны приуготовлениям",https://www.prlib.ru/item/459653,0
1766,"Сравнение жития и дел разных, а особливо восточных и индийских великих героев и знаменитых мужей,. Ч. 1",https://www.prlib.ru/item/1351642,0
1766,[Штат Главной провиантской канцелярии и ее конторы и ведомости провиантских магазинов.,https://www.prlib.ru/item/713152,0
1766,"Разсуждения служащия руководством к новому установлению Шляхетнаго кадетскаго корпуса, сколько принадлежит до воинской части онаго",https://www.prlib.ru/item/713044,0
1767,"Российская история жизни всех древних от самаго начала России государей, все великия и вечной достойныя памяти императора Петра Великаго действия, его наследниц и наследников ему последование и описание в Севере златаго века во время царствования Екатерины Великой в себе заключающая.. Т.1",https://www.prlib.ru/item/442173,0
1767,Правда руская данная в одиннатцатом веке от великих князей Ярослава Владимирича и сына его Изяслава Ярославича,https://www.prlib.ru/item/438749,0
1767,"Указы всепресветлейшей, державнейшей, великой государыни императрицы Екатерины Алексеевны самодержицы всероссийской,",https://www.prlib.ru/item/459709,0
1767,Наказ Коммиссии о составлении проекта новаго уложения,https://www.prlib.ru/item/903565,0
1767,"Сочинение о варягах автора Феофила Сигефра Беэра, бывшаго профессора восточной истории, и восточных языков, при Императорской Академии наук",https://www.prlib.ru/item/370807,0
1767,"Библиотека российская историческая,. Ч. 1. [Летопись Несторова с продолжателями по Кенигсбергскому списку, до 1206 года]",https://www.prlib.ru/item/398978,0
1767,Учреждение Императорскаго Воспитательнаго для приносных детей дома и госпиталя для бедных родильниц в столичном городе Москве. Ч.1,https://www.prlib.ru/item/713414,0
1767,"Инструкция Правительствующаго Cената из Межевой экспедиции землемерам отправляемым по указам, челобитьям и требованиям на собственном тех владений, чьи земли, содержании, для особливаго оных земель от других прикосновенных к ним владельческих дач обмежевания, принадлежащая до сведения и исполнения, как тех правительств, от которых сии землемеры отправлены, так и владельцов.",https://www.prlib.ru/item/467870,0
1767,Географическое описание реки Волги от Твери до Дмитревска для путешествия ея императорскаго величества по оной реке,https://www.prlib.ru/item/406204,0
1767,"Табель о рангах всех чинов, воинских, статских и придворных, которые в котором классе чины, и которые в одном классе, те имеют по старшинству времени, вступления в чин между собою, однакож воинские выше прочих, хотяб и старее кто в том классе пожалован был",https://www.prlib.ru/item/714357,0
1767,Юности честное зерцало или Показание к житейскому обхождению,https://www.prlib.ru/item/463992,0
1767,Руская летопись по Никонову списку. Ч. 1. До 1094 года,https://www.prlib.ru/item/362375,0
1767,Описание дороги от Санктпетербурга до Москвы,https://www.prlib.ru/item/434704,0
1767,"География российская и соседственных с Россиею областей около 947 году, из книг северных писателей выбрана автора Беэра, бывшаго ориентальной истории и языков профессора при Имп. Академии наук",https://www.prlib.ru/item/406213,0
1768,"Судебник царя и великаго князя Ивана Васильевича, законы из Юстиниановых книг, указы дополнительные к судебнику и таможенный устав царя и великаго князя Ивана Васильевича",https://www.prlib.ru/item/1342460,0
1768,Пехотный строевой устав,https://www.prlib.ru/item/713040,0
1768,"Судебник царя и великаго князя Ивана Васильевича, законы из Юстиниановых книг, указы дополнительные к судебнику и таможенный устав царя и великаго князя Ивана Васильевича",https://www.prlib.ru/item/372571,0
1768,"Слово о прямом и ближайшем способе к научению юриспруденции,",https://www.prlib.ru/item/806367,0
1768,Трактат вечный между Всероссийскою империею и Речью Посполитою Польскою,https://www.prlib.ru/item/712858,0
1768,Штат Святейшаго синода с Московскою онаго конторою,https://www.prlib.ru/item/462979,0
1768,"История российская с самых древнейших времен неусыпными трудами через тритцать лет собранная и описанная покойным тайным советником и астраханским губернатором, Василием Никитичем Татищевым. Кн.1, ч.1",https://www.prlib.ru/item/690073,0
1768,"Устав воспитания двух сот благородных девиц учрежденнаго Ея Величеством Государынею Императрицею Екатериною Второю самодержицею Всеросийскою материю отечества и протчая, и протчая, и протчая",https://www.prlib.ru/item/459873,0
1768,"Имянной список господам депутатам, выбранным в Коммиссию о сочинении проэкта новаго уложения, кто из котораго места выбраны, и кто кому имянно здали, также в разныя учрежденныя от большаго собрания частныя коммиссии определены и ныне действительно находятся генваря по 1 число, 1768 году.",https://www.prlib.ru/item/714819,0
1768,"Наказ Коммиссии, о составлении проекта новаго уложения",https://www.prlib.ru/item/428551,0
1768,"Описание древняго славенскаго языческаго баснословия,",https://www.prlib.ru/item/713083,0
1768,Трактат вечный между Всероссийскою империею и Речью Посполитою Польскою,https://www.prlib.ru/item/457699,0
1768,"Российская история жизни всех древних от самаго начала России государей, все великия и вечной достойныя памяти императора Петра Великаго действия, его наследниц и наследников ему последование и описание в Севере златаго века во время царствования Екатерины Великой в себе заключающая.. Т.2",https://www.prlib.ru/item/442175,0
1769,Чин освящения знаков ордена святаго великомученика и победоносца Георгия,https://www.prlib.ru/item/711432,0
1769,"Духовная церемония производившаяся во время всевожделеннейшаго присудствия ея императорскаго величества великия государыни премудрейшия монархини и попечительнейшия матери Екатерины Вторыя в Казане,",https://www.prlib.ru/item/408148,0
1769,Статуты военнаго ордена святаго великомученика и победоносца Георгия.,https://www.prlib.ru/item/714321,0
1769,"Российская история жизни всех древних от самаго начала России государей, все великия и вечной достойныя памяти императора Петра Великаго действия, его наследниц и наследников ему последование и описание в Севере златаго века во время царствования Екатерины Великой в себе заключающая.. Т.3",https://www.prlib.ru/item/442174,0
1769,"Повсядневных дворцовых времени государей царей и великих князей Михаила Феодоровича, и Алексея Михайловича, записок. Ч. 1",https://www.prlib.ru/item/726088,0
1769,Спарта,https://www.prlib.ru/item/1804187,0
1769,Учреждение Санктпетербургскому и Московскому банкам для вымена государственных ассигнации.,https://www.prlib.ru/item/713137,0
1769,"Царственная книга, то есть Летописец царствования царя Иоанна Васильевича, от 7042 году до 1761,",https://www.prlib.ru/item/903561,0
1769,"История российская с самых древнейших времен неусыпными трудами через тритцать лет собранная и описанная покойным тайным советником и астраханским губернатором, Василием Никитичем Татищевым. Кн. 1, ч. 2",https://www.prlib.ru/item/690082,0
1769,"Повсядневных дворцовых времени государей царей и великих князей Михайла Феодоровича и Алексея Михайловича, записок часть первая-[вторая]",https://www.prlib.ru/item/714484,0
1769,Учреждение Санктпетербургскому и Московскому банкам для вымена государственных ассигнаций.,https://www.prlib.ru/item/903635,0
1769,Краткое описание древнейшаго и новейшаго состояния Оттоманской Порты,https://www.prlib.ru/item/713163,0
1769,Учреждение особливаго училища при Воскресенском Новодевичьем монастыре для воспитания малолетних девушек,https://www.prlib.ru/item/811367,0
1769,"Наставление от предводителя Второй армии войску ему порученному, каким образом поступать по расположении на зимния квартиры, к заграждению границ в предохранение ему вверенных, при случае неприятельскаго приближения и нападения на учрежденныя кордоны, как форпостам так линиею, а позадь оной и из войск расположенными, сочиненное им в Польше в лагере при деревне Покатилове 1769 года октября 24 дня",https://www.prlib.ru/item/715091,0
1769,"Брак души благочестивыя, небесному жениху Христу сыну Божию уневестившияся,",https://www.prlib.ru/item/713061,0
1769,"Российская универсальная грамматика, или Всеобщее писмословие,",https://www.prlib.ru/item/362192,0
1770,"Начальныя основания вексельнаго права,",https://www.prlib.ru/item/899325,0
1770,"Славенския древности, или Приключения славенских князей",https://www.prlib.ru/item/713085,0
1770,Наказ ея императорскаго величества Екатерины Вторыя самодержицы всероссийския данный Коммиссии о сочинении проекта новаго уложения,https://www.prlib.ru/item/428550,0
1770,История российская от древнейших времян.. Т. 1. От начала до кончины великаго князя Ярослава Владимеровича,https://www.prlib.ru/item/416893,0
1770,Известия византийских историков. Ч.1. О славянах,https://www.prlib.ru/item/711087,0
1770,Журнал военных действий армей ея императорскаго величества 1769-[1771] года,https://www.prlib.ru/item/714352,0
1770,"Наставление от предводителя Второй армии, генерал-аншефа, сенатора и кавалера графа Панина войску ему врученному, на предводительство в наступательныя действия противу войска турецкаго,",https://www.prlib.ru/item/715092,0
1770,"Журнал или Поденная записка, блаженныя и вечнодостойныя памяти государя императора Петра Великаго с 1698 года, даже до заключения Нейштатскаго мира.. Ч. 1",https://www.prlib.ru/item/408595,0
1770,"Существенное изображение естества народных обществ и всякаго рода законов,",https://www.prlib.ru/item/372642,0
1771,"Самуила Георга Гмелина, доктора врачебной науки, Императорской Академии наук, Лондонскаго, Гарлемскаго и Вольнаго экономическаго общества члена Путешествие по России для изследования трех царств естества. Ч. 1. Путешествие из Санктпетербурга до Черкаска, главнаго города донских козаков в 1768 и 1769 годах",https://www.prlib.ru/item/1333268,0
1771,"Надпись на завоевание крымских городов и на покорение их под Российскую державу, II армии главным предводителем, генералом и кавалером князем Василием Михайловичем Долгоруковым в 1771 году",https://www.prlib.ru/item/428523,0
1771,Опыт российской географии,https://www.prlib.ru/item/434875,0
1771,Наказ ея императорскаго величества Екатерины II учрежденной Коммиссии о составлении проекта новаго уложения,https://www.prlib.ru/item/428549,0
1771,"Сокращенное описание жизни Петра Великаго, императора всея России.",https://www.prlib.ru/item/714345,0
1771,Чесмесский бой,https://www.prlib.ru/item/1918956,0
1771,Табель о рангах,https://www.prlib.ru/item/714358,0
1771,Путешествие его величества в Париж,https://www.prlib.ru/item/441226,0
1771,Топографическия известия служащия для полнаго географическаго описания Российской империи,https://www.prlib.ru/item/457666,0
1771,Наставление экономическим правлениям,https://www.prlib.ru/item/713200,0
1771,"Российской Целлариус, или Этимологической российской лексикон,",https://www.prlib.ru/item/362264,0
1771,"Самуила Георга Гмелина, доктора врачебной науки, Императорской Академии наук, Лондонскаго, Гарлемскаго и Вольнаго экономическаго Санктпетербургскаго общества члена Путешествие по России для изследования трех царств естества. Ч. 1. Путешествие из Санктпетербурга до Черкаска, главнаго города донских козаков в 1768 и 1769 годах",https://www.prlib.ru/item/715004,0
1771,"Летопись о многих мятежах и о разорении Московскаго государства от внутренних и внешних неприятелей и от прочих тогдашних времен многих случаев, по преставлении царя Ивана Васильевича; а паче о межгосударствовании по кончине царя Феодора Иоанновича, и о учиненном исправлении книг в царствовании благовернаго государя царя Алексея Михайловича в 7163/1655 году.",https://www.prlib.ru/item/342707,0
1772,"Почтовое учреждение для двух белоруских губерний, Псковской и Могилевской.",https://www.prlib.ru/item/714505,0
1772,Царственной летописец,https://www.prlib.ru/item/910717,0
1772,"Генеральнаго плана Императорскаго Воспитательнаго дома исполнительное учреждение вдовьей, ссудной и сохранной казны, в пользу всего общества",https://www.prlib.ru/item/714664,0
1772,Житие и славныя дела государя императора Петра Великаго самодержца всероссийскаго. Ч. 1,https://www.prlib.ru/item/408477,0
1772,Опыт историческаго словаря о российских писателях.,https://www.prlib.ru/item/355154,0
1772,Дневныя записки путешествия доктора и Академии наук адъюнкта Ивана Лепехина по разным провинциям Российскаго государства.... [Ч. 1]. ... 1768 и 1769 году,https://www.prlib.ru/item/407619,0
1772,"Правила о произношении российских букв, и о исправном техже в новейшем гражданском письме употреблении, или о правописании, собранныя из российских грамматик",https://www.prlib.ru/item/360089,0
1772,"Житие Петра Великаго императора и самодержца всероссийскаго, отца отечества",https://www.prlib.ru/item/738675,0
1772,Житие и славныя дела государя императора Петра Великаго самодержца всероссийскаго. [Ч. 2],https://www.prlib.ru/item/408476,0
1772,Непостижимость судьбы,https://www.prlib.ru/item/706872,0
1772,Дневныя записки путешествия доктора и Академии наук адъюнкта Ивана Лепехина по разным провинциям Российскаго государства.... [Ч.2]. ... в 1770 году,https://www.prlib.ru/item/407620,0
1772,"Журнал или Поденная записка, блаженныя и вечнодостойныя памяти государя императора Петра Великаго с 1698 года, даже до заключения Нейштатскаго мира.. Ч. 2. Ч. 2",https://www.prlib.ru/item/408596,0
1773,"Сказание о морском сражении, происходившем между россиянами и турками при бреге Натолии июня 24. 25 и 26. 1770 года. выбранное из достовернейших записок.",https://www.prlib.ru/item/713054,0
1773,Объявление и прошение касающияся до собрания разных языков в примерах,https://www.prlib.ru/item/354593,0
