year,title,link,DONE
1778,"Роспись московских церквей, соборных, монастырских, ружных, приходских, предельных, и домовых; внутрь и вне царствующаго града состоящих",https://www.prlib.ru/item/713087,0
1778,"Указы всепресветлейшия державнейшия великия Государыни Императрицы Екатерины Алексеевны самодержицы Всероссийския,",https://www.prlib.ru/item/459713,0
1778,"Речи ея императорскому величеству, благочестивейшей, великой государыне Екатерине Второй, императрице и самодержице всероссийской, и его императорскому высочеству пресветлейшему всероссийскаго престола наследнику, государю, великому князю Павлу Петровичу,",https://www.prlib.ru/item/442007,0
1778,"Письма к государю императору Петру Великому от генерал-фельдмаршала, тайнаго советника малтийскаго, с. апостала Андрея, Белаго орла и прусскаго ордена кавалера, графа Бориса Петровича Шереметева. Ч. 1",https://www.prlib.ru/item/903504,0
1778,"Российский лексикон по алфавиту,. Ч. 2",https://www.prlib.ru/item/362223,0
1778,"Речь благодарственная Ее Императорскому Величеству, говоренная Амвросием, епископом Севским и Брянским, при посвящении его во епископа, которое совершалось в присутствии Ее Императорского Величества и Их Императорских Высочеств июля 5 дня 1778 года в Троицкой пустыне, что по Петергофской дороге",https://www.prlib.ru/item/442016,0
1778,"Письма к государю императору Петру Великому от генерал-фельдмаршала, тайнаго советника малтийскаго, с. апостала Андрея, Белаго орла и прусскаго ордена кавалера, графа Бориса Петровича Шереметева. Ч. 2",https://www.prlib.ru/item/711996,0
1778,"Слово о побуждениях, служащих к принятию судейской должности, и о удовольствии оттуда проистекающем,",https://www.prlib.ru/item/713346,0
1778,"Указы всепресветлейшия державнейшия великия Государыни Императрицы Екатерины Алексеевны самодержицы Всероссийския,",https://www.prlib.ru/item/459715,0
1778,"Речь Святейшаго правительствующаго Синода члену, преосвященнейшему Платону архиепископу московскому и калужскому и Святотроицкия Сергиевы лавры священно-архимандриту, на всерадостное из СанктПетербурга в первопрестольный град Москву прибытие от священства паствы его говоренная Сретенскаго собора протоиерееем и Консистории членом, Иоанном Ставровским. Декабря 2 дня, 1778 года",https://www.prlib.ru/item/442045,0
1778,"Книга Устав морской,",https://www.prlib.ru/item/336980,0
1778,"Российский лексикон по алфавиту,. Ч. 1",https://www.prlib.ru/item/362222,0
1778,Стат Водяной коммуникации,https://www.prlib.ru/item/714593,0
1778,"Стат Володимирской губернии, состоящей из четырнадцати уездов, а именно: Володимирскаго, Суздальскаго, Переславльско-Залесскаго, Юрьевско-Польскаго, Шуйскаго, Муромскаго, Гороховскаго, Александровскаго, Киржачскаго, Покровскаго, Судогдскаго, Ковровскаго, Вязниковскаго и Меленковскаго",https://www.prlib.ru/item/453976,0
1779,"Указы всепресветлейшия державнейшия великия государыни императрицы Екатерины Алексеевны самодержицы всероссийския,",https://www.prlib.ru/item/825882,0
1779,"Уложение, по которому суд и росправа во всяких делах в Российском государстве производится, сочиненное и напечатанное при владении его величества государя царя и великого князя Алексея Михайловича, всея России самодержца, в лето от сотворения мира 7156",https://www.prlib.ru/item/679941,0
1779,Стат Нижегородской губернии,https://www.prlib.ru/item/372230,0
1779,Новое предложение о псовой охоте или Приятное с полезным,https://www.prlib.ru/item/1332645,0
1779,Учреждение Инвалиднаго дома в Москве для отставных неимущих штаб и обер-офицеров,https://www.prlib.ru/item/714397,0
1779,Стат Тамбовской губернии,https://www.prlib.ru/item/372232,0
1779,"Указы всепресветлейшия державнейшия великия государыни императрицы Екатерины Алексеевны самодержицы всероссийския, состоявшиеся с 1765 июля 1 го генваря по 1 е число 1766 года",https://www.prlib.ru/item/459712,0
1779,"[Указы, манифесты и другие правительственные постановления, объявленные из Государственной Военной коллегии.",https://www.prlib.ru/item/394498,0
1779,"Письма к государю императору Петру Великому от генерал-фельдмаршала, тайнаго советника малтийскаго, с. апостала Андрея, Белаго орла и прусскаго ордена кавалера, графа Бориса Петровича Шереметева. Ч. 3",https://www.prlib.ru/item/712260,0
1779,"Диплом на княжеское Российския империи достоинство с подтверждением римскаго императорскаго диплома, данный от его величества государя императора Петра Великаго самодержца всероссийскаго фамилии князей Меншиковых, 1707 года",https://www.prlib.ru/item/407570,0
1779,Стат Нижегородской губернии,https://www.prlib.ru/item/453874,0
1779,"Стат Воронежской губернии состоящей из пятнадцати уездов, а именно: Воронежскаго, Задонскаго, Бобровскаго, Землянскаго, Нижне-Девицкаго, Бирюченскаго, Ливенскаго, Калитвянскаго, Валуйскаго, Беловодскаго, Купенскаго, Богучарскаго, Павловскаго, Острогожскаго и Коротояцкаго",https://www.prlib.ru/item/372229,0
1779,"Положение общества дворянскаго Тверскаго наместничества, и План училища, учреждаемаго в Твери, на общественном дворянском иждивении",https://www.prlib.ru/item/358725,0
1779,Россияда,https://www.prlib.ru/item/736029,0
1779,"Духовный регламент. Благодатию и милосердием человеколюбца бога, тщанием же и повелением богом даннаго и богом умудреннаго всепресветлейшаго, державнейшаго государя Петра Перьваго императора и самодержца всероссийскаго, и прочая, и прочая, и прочая в святой православной Российской церькви, по соизволению и приговору всероссийскаго духовнаго чина и Правительствующаго Сената, в царствующем Санктпетербурге, в лето от Рождества Христова 1721, месяца февруария 14, сочиненный",https://www.prlib.ru/item/408165,0
1779,"Изследование юридическое о принадлежащем для суда месте, о судебной власти, о должности судейской, о челобитной и доказательстве судебном",https://www.prlib.ru/item/334365,0
1779,"Письма к государю императору Петру Великому от генерал-фельдмаршала, тайнаго советника малтийскаго, с. апостала Андрея, Белаго орла и прусскаго ордена кавалера, графа Бориса Петровича Шереметева. Ч. 4",https://www.prlib.ru/item/713328,0
1780,Указы блаженныя и вечнодостойныя памяти государя императора Петра Великаго самодержца всероссийскаго.,https://www.prlib.ru/item/722633,0
1780,"Разсуждение о злоупотреблении разума некоторыми новыми писателями, и опровержение их вредных правил.",https://www.prlib.ru/item/713189,0
1780,"Указы всепресветлейшия державнейшия великия Государыни Императрицы Екатерины Алексеевны самодержицы Всероссийския,",https://www.prlib.ru/item/459716,0
1780,"Слово при начатии открытия Санктпетербургской губернии по высочайшим учреждениям благочестивейшия великия государыни императрицы Екатерины Алексеевны самодержицы всероссийской, проповеданное в соборной церкви Рождества пресвятыя Богородицы, что при Невской перспективе, святейшаго правительствующаго Синода членом Гавриилом, архиепископом Новгородским и Санктпетербургским маия в 19 день 1780 года",https://www.prlib.ru/item/445943,0
1780,"Стат Симбирскаго наместничества,",https://www.prlib.ru/item/453879,0
1780,Abr?g? de L'Histoire g?n?rale des voyages. Tome 21,https://www.prlib.ru/item/1736119,0
1780,"Благочестивейшия самодержавнейшия великия государыни императрицы Екатерины Вторыя учреждения для управления губерний Всероссийския империи, в коих столицы",https://www.prlib.ru/item/713138,0
1780,"Примерный стат Вологодскаго наместичества [!] состоящаго их трех областей или провинций; первой Вологодской из пяти уездов: Вологодскаго, Тотемскаго, Вельскаго, Грязоветскаго, Кадниковскаго; второй Великоустюжскаго из семи уездов: Великоустюжскаго, Соливычегодскаго, Яренскаго, Лальскаго, Никольскаго, Красноборскаго, Устьсысольскаго и третий Архангельской из семи же уездов: Архангельскаго, Шенкурскаго, Мезенскаго, Кольскаго, Онегскаго, Пинежскаго и еще одного, где по удобности назначит генерал-губернатор",https://www.prlib.ru/item/439472,0
1780,"Регламент ш[к]иперам и прочим приходящим на торговых кораблях в порты Российскаго государства, дабы ведали, как поступать, и чего остерегаться во оных",https://www.prlib.ru/item/714373,0
1780,"Стат Вятскаго наместничества состоящаго из тринадцати уездов, а именно: Вятскаго, Слободскаго, Кайгородскаго, Котельнитскаго, Уржумскаго, Орловскаго на Вятке, Яранскаго, Царевосанчурскаго, Глазовскаго, Елабужскаго, Малмышскаго, Сарапульскаго и Нолинскаго",https://www.prlib.ru/item/453869,0
1780,Стат Саратовскаго наместничества,https://www.prlib.ru/item/453878,0
1780,[Cartes pour servir ? l'Abr?g? de L'Histoire g?n?rale des voyages ... par M. de la Harpe,https://www.prlib.ru/item/1751002,0
1780,Стат Харьковской губернии,https://www.prlib.ru/item/453880,0
1780,Часовник,https://www.prlib.ru/item/1599953,0
1780,Дневныя записки путешествия доктора и Академии наук адъюнкта Ивана Лепехина по разным провинциям Российскаго государства.... Ч.3. ... в 1771 году,https://www.prlib.ru/item/407621,0
1780,Статуты военнаго ордена святаго великомученика и победоносца Георгия. Учрежденнаго ея величеством всемилостивейшею государынею императрицею и самодержицею всероссийскою Екатериною Алексеевною. 1769 года ноября 26 дня,https://www.prlib.ru/item/910700,0
1780,"Любопытный месяцеслов на 1780 год, который есть высокосный,",https://www.prlib.ru/item/714506,0
1780,"Стат Пензенскаго наместничества,",https://www.prlib.ru/item/372231,0
1780,"Краткия правила российской грамматики,",https://www.prlib.ru/item/341400,0
1780,Стат Санктпетербургской губернии,https://www.prlib.ru/item/453877,0
1780,Топографическия примечании на знатнейшия места путешествия ея императорскаго величества в Белорусския наместничества,https://www.prlib.ru/item/457667,0
1780,"Уложение, по которому суд и росправа во всяких делах в Российском государстве производится",https://www.prlib.ru/item/459776,0
1780,"Описание действия, от стороны Святейшаго правительствующаго Синода члена, преосвященнаго Иннокентия, архиепископа Псковского и Рижского, и его Семинарии, происходившаго во время всевожделеннаго прибытия, ея императорского величества, всеавгустейшия императрицы и самодержицы всероссийския, Екатерины Вторыя, во Псков, и высочайшаго ея величества в нем пребывания, маия от 13 го до 16 го дней продолжавшагося, 1780 года",https://www.prlib.ru/item/434673,0
1781,Главы к Воинскому уставу о полевой службе,https://www.prlib.ru/item/714662,0
1781,"Варнавы Бриссония, главнаго в Париже сенатора, О Перском царстве. Ч. 1. О царском величестве, и штате двора персидскаго",https://www.prlib.ru/item/1333243,0
1781,"Слово о единодушии,",https://www.prlib.ru/item/713102,0
1781,Устав о соли.,https://www.prlib.ru/item/714553,0
1781,Собрание нужных вещей для сочинения новой географии о Российской империи. Ч. 1. О Тульском наместничестве,https://www.prlib.ru/item/831718,0
1781,"Начальныя основания вексельнаго права, а особливо российскаго купно и шведскаго",https://www.prlib.ru/item/899326,0
1781,"История российская от древнейших времян.. Т. 4. От начала царствования великаго князя Димитрия Иоанновича, проименованного Донской, до царствования царя Иоанна Васильевича,",https://www.prlib.ru/item/416898,0
1781,"Указы всепресветлейшия державнейшия великия государыни императрицы Екатерины Алексеевны самодержицы всероссийския, состоявшиеся генваря с 1 го июля по 1 е число 1767 года",https://www.prlib.ru/item/459714,0
1781,"Устав купеческаго водоходства по рекам, водам и морям.. Ч.2",https://www.prlib.ru/item/715233,0
1781,Устав о вине.,https://www.prlib.ru/item/714552,0
1781,"Варнавы Бриссония, главнаго в Париже сенатора, О Перском царстве. Ч. 3. О военном деле персидскаго государства",https://www.prlib.ru/item/1333241,0
1781,"Новый лексикон на немецком, французском, латинском, итальянском и российском языках, изданный Матвеем Гавриловым, членом Педагогической семинарии, учрежденной при Императорском Московском университете",https://www.prlib.ru/item/351688,0
1781,Летописец содержащий в себе российскую историю от 6360/852 до 7106/1598 году.,https://www.prlib.ru/item/713170,0
1781,Стат Московской губернии,https://www.prlib.ru/item/453873,0
1781,Стат Казанскаго наместничества,https://www.prlib.ru/item/453872,0
1781,"Историческое описание российской коммерции при всех портах и границах. Т. 1, кн. 1",https://www.prlib.ru/item/335093,0
1781,"Устав купеческаго водоходства по рекам, водам и морям.. Ч.1",https://www.prlib.ru/item/469604,0
1781,"Варнавы Бриссония, главнаго в Париже сенатора, О Перском царстве. Ч. 2. О богослужении, законах и обыкновениях перских",https://www.prlib.ru/item/1333245,0
1781,"Акт разграничения между Новороссийскою губерниею и Польскою Украиною,",https://www.prlib.ru/item/396793,0
1781,О браках правоверных лиц с иноверными,https://www.prlib.ru/item/706875,0
1782,"Историческия и топографическия известия по древности о России; и частно о городе Вологде, и его уезде и продолжении онаго по известие сие",https://www.prlib.ru/item/1707680,0
1782,Беседование Максима Грека о пользе грамматики;,https://www.prlib.ru/item/320246,0
1782,"Трактат о дружбе и торговле между Российскою империею и короною Датскою, заключенный в Санктпетербурге октября 8/19 дня, 1782 года",https://www.prlib.ru/item/375716,0
1782,"Общий тариф для всех портов и пограничных таможень Российской империи, кроме Астрахани, Оренбурга и Сибири.. [Ч. 2. Об отпускаемых из России товарах]",https://www.prlib.ru/item/354583,0
1782,"Путешествие китайскаго посланника к Калмыцкому Аюке-хану, с описанием земель и обычаев российских",https://www.prlib.ru/item/687991,0
1782,Докладные пункты на всевысочайшее решение вашего императорскаго величества по случаю возобновления чрез три года выборов в наместничествах по учреждениям для управления оных,https://www.prlib.ru/item/713076,0
1782,"Краткия правила российской грамматики,",https://www.prlib.ru/item/341401,0
1782,"Историческое описание российской коммерции при всех портах и границах. Т. 1, кн. 2",https://www.prlib.ru/item/335094,0
1782,"Общий тариф для всех портов и пограничных таможень Российской империи, кроме Астрахани, Оренбурга и Сибири.. [Ч. 1. О привозных из чужих краев в Россию товарах]",https://www.prlib.ru/item/354582,0
1782,"Положение о городовых пенечных, льняных, табачных, масляных, сальных и других товаров анбарах в столичном, губернском и приморском городе Святаго Петра.",https://www.prlib.ru/item/358719,0
1782,"Краткое описание российскаго торга, отправляемаго сухим путем с Китаем, Бухариею, калмыками, Курляндиею и Польшею",https://www.prlib.ru/item/468066,0
1782,"Описание императорскаго, столичнаго города Москвы,",https://www.prlib.ru/item/355078,0
1782,Устав благочиния или Полицейской.,https://www.prlib.ru/item/388866,0
1782,"Обмена шляп, или Благоразумием уничтоженное покушение",https://www.prlib.ru/item/711285,0
1782,Правила для учащихся в народных училищах,https://www.prlib.ru/item/714605,0
1782,"Слово при обращении раскольников в Московском большом Успенском соборе,",https://www.prlib.ru/item/713169,0
1782,Краткое историческое описание Святотроицкия Сергиевы лавры,https://www.prlib.ru/item/713037,0
1783,"Стат Екатеринославскаго наместничества, состоящаго из двенадцати уездов",https://www.prlib.ru/item/453870,0
1783,"Клееманово путешествие из Вены в Белград и Новую Килию, також в земли буджатских и нагайских татар и во весь Крым, с возвратом через Константинополь, Смирну и Триест в Австрию в 1768, 1769 и 1770 годах, с приобщением описания достопамятностей крымских",https://www.prlib.ru/item/734745,0
1783,"Начертание путешествия их императорских высочеств, государя великаго князя Павла Петровича и государыни великой княгини Марии Феодоровны под именем графа и графини Северных,",https://www.prlib.ru/item/428780,0
1783,Инструкция землемерам к размежеванию Могилевской и Полоцкой губерний,https://www.prlib.ru/item/467869,0
1783,"Слово на открытие наместничества в Риге проповеданное Святейшаго Синода членом Иннокентием архиепископом Псковским и Рижским октября 29 дня, 1783 года",https://www.prlib.ru/item/445927,0
1783,"Российский царский памятник,",https://www.prlib.ru/item/714508,0
1783,"Стат Ревельскаго наместничества, состоящаго из пяти уездов",https://www.prlib.ru/item/453875,0
