year,title,link,DONE
1682,Слово на Никиту Пустосвята,https://www.prlib.ru/item/713797,1
1683,Слово благодарственное о избавлении церкви от отступников,https://www.prlib.ru/item/713798,1
1686,Евангелие учительное,https://www.prlib.ru/item/1599870,1
1697,Псалтырь царя Давида с кратким толкованием,https://www.prlib.ru/item/1672469,0
1700,"[Книга житий святых...на три м[е]с[я]цы третии март, априль, маий]",https://www.prlib.ru/item/394436,1
1704,"Лексикон треязычный, сиречь речений славянских, эллино-греческих и латинских сокровищ из различных древних и новых книг собранное и по славянскому алфавиту в чин расположенное",https://www.prlib.ru/item/342071,1
1709,"Архитектура воинская. Гипотетическая, и еклектическая",https://www.prlib.ru/item/397225,1
1710,[Азбука гражданская с нравоучениями],https://www.prlib.ru/item/315769,1
1710,Инструкции и артикулы военные надлежащие к россиискому флоту,https://www.prlib.ru/item/413680,0
1713,"Книга Марсова или воинских дел от воиск царскаго величества россииских. По взятии преславных фортификацеи, и на разных местах храбрых баталии учиненных. Над воиски его королевскаго величества Свеиского.",https://www.prlib.ru/item/713789,0
1714,Указ в дополнение о кадетах,https://www.prlib.ru/item/459643,0
1715,"Устав о воисках морских, и о их арсеналах. Людовика Четвертаго надесять короля французского и наварскаго.",https://www.prlib.ru/item/714831,0
1715,Книга о эксерциции церемониах и должностях воинским людем надлежащих,https://www.prlib.ru/item/713794,0
1716,"Книга ордера или во флоте морских прав,",https://www.prlib.ru/item/713213,0
1716,"Генералные сигналы, надзираемые во флоте, во время бою.",https://www.prlib.ru/item/406170,0
1716,Книга устав воинскии,https://www.prlib.ru/item/417755,0
1717,"Het Nieuwe Testament, Of Te alle boecken des Nieuwen Verbondts onses Heeren Jesu Christi",https://www.prlib.ru/item/1336100,0
1717,"Разсуждение какие законные причины его царское величество Петр Первыи царь и повелитель всероссиискии и протчая, и протчая, и протчая: к начатию воины против короля Карола 12, шведского 1700 году имел, и кто из сих обоих потентатов, во время сеи пребывающеи воины, более умеренности и склонности к примирению показывал, и кто в продолжении онои, с толь великим разлитием крови християнскои, и разорением многих земель виновен; и с которои воюющеи страны та воина по правилам християнских и политичных народов более ведена.",https://www.prlib.ru/item/712121,1
1718,"В посольскои канцелярии в Москве при разборе старинных архив или дел и писем, наидена грамота подлинная его цесарскаго величества римскаго Максимилиана, за его собственною рукою и печатью златою 1514 году, писанная на немецком старинном языке, к царю и великому князю всероссиискому, Василию Ивановичу, ко отцу царя Иоанна Василиевича, которого помянутои цесарь в тои грамоте своеи титуловал цесарем всероссииским: и понеже оная яко вещь древняя и куриозная, и ко утвержению без прекословному того высокого достоинства за толко уже лет всероссииским монархом надлежит, и от цесаря римского яко в свете первои градус имеющаго монарха воздаванная; того ради указал его царское величество оную грамоту перевесть на россиискои язык, и для всенароднаго известия в типографии своеи в Санктъпитербурхе выдать в печать, на славенском и самом том старонемецком языке, которои в подлиннои грамоте употреблен",https://www.prlib.ru/item/322714,0
1718,[Манифест об отрешении от наследия его царского величества перворожденного сына царевича Алексея Петровича],https://www.prlib.ru/item/394438,0
1718,"Обьявление розыскного дела и суда, по указу его царскаго величества на царевича Алексея Петровича, в Санктъпитербурхе отправленнаго, и по указу его величества в печать, для известия сенароднаго, сего июня в 25 день, 1718, выданое",https://www.prlib.ru/item/354609,0
1719,Земноводнаго круга краткое описание.,https://www.prlib.ru/item/812155,0
1720,Царского величества указ,https://www.prlib.ru/item/460847,0
1720,Его царского величества Генералный регламент или устав,https://www.prlib.ru/item/408206,0
1721,"Ратификация королевскаго величества свеискаго, на трактат вечнаго мира, учиненнои с его царским величеством в Неиштате,",https://www.prlib.ru/item/441841,0
1721,"Речъ, которая публично в церкви его царскому пресветлому величеству, от Синода и Сената говорена",https://www.prlib.ru/item/442015,0
1721,Царского величества указ из Сената,https://www.prlib.ru/item/460845,0
1721,Царского величества указ из Сената.,https://www.prlib.ru/item/460844,0
1721,"Ратификация королевскаго величества свеискаго на трактат вечнаго мира, учиненнои с его царским величеством в Неиштате, со внесением всего онаго трактата",https://www.prlib.ru/item/717221,0
1721,Указ.,https://www.prlib.ru/item/713791,0
1721,"Реляция что прежде, и при отправлении назначеннаго, от его императорского величества всероссииского.",https://www.prlib.ru/item/441985,0
1721,Царского величества указ,https://www.prlib.ru/item/460846,0
1721,Указ его величества императора и самодержца всероссиискаго,https://www.prlib.ru/item/459645,0
1722,Правда воли монаршеи.,https://www.prlib.ru/item/714832,0
1722,"Регламент о управлении адмиралтеиства и верфи и о должностях колегии Адмиралтеискои, и протчих всех чинов при адмиралтеистве обретающихся.",https://www.prlib.ru/item/361923,0
1722,"Табель о рангах всех чинов, воинских, статских, и придворных, которые в котором классе чины, и которые в одном классе, те имеют по старшеству времени, вступления в чин между собою, однакож воинские выше протчих, хотяб и старее кто в том классе пожалован был",https://www.prlib.ru/item/454265,0
1722,"Книга историография початия имене, славы и разширения народа славянского, и их цареи и владетелеи под многими имянами, и со многими царствиями, королевствами, и провинциами.",https://www.prlib.ru/item/713521,0
1723,???,https://www.prlib.ru/item/464079,0
1723,Указ его величества императора и самодержца всероссииского. Обьявляется во всенародное известие.,https://www.prlib.ru/item/459646,0
1724,Указ его величества императора и самодержца всероссииского.,https://www.prlib.ru/item/459648,0
1724,"О денгах мясных на гошпиталь, и на покупку лошадеи, на мундир, и на полковые припасы, каким образом полковник вкупе с афицерами, оные употреблять, и в покупках, и подрядах поступать должны",https://www.prlib.ru/item/429740,0
1724,"[О сборе подушных денег, о повинностях земских обывателей в пользу квартирующих войск и о наблюдении полковым начальством благочиния и порядка в селениях, войсками занимаемых]",https://www.prlib.ru/item/394459,0
1724,"Указ его величества императора и самодержца всероссииского, обьявляется во всенародное известие.",https://www.prlib.ru/item/713792,0
1724,"Указ его величества Петра Великого, императора и самодержца всероссийского. Обьявляется во всенародное известие",https://www.prlib.ru/item/388531,0
1724,"Описание коронации ее величества императрицы, Екатерины Алексиевны торжественно отправленнои, в царствующем граде Москве, 7 маия, 1724 году",https://www.prlib.ru/item/434721,0
1724,Указ его величества императора и самодержца всероссиискаго,https://www.prlib.ru/item/459644,0
1724,Указ его величества императора и самодержца всероссииского. оподозрениях на судеи,https://www.prlib.ru/item/459647,0
1724,"Тариф Санктъпитербургского, Выборгского, Нарвского, Архангелогородского, Кольского, портов",https://www.prlib.ru/item/372726,0
1725,Описание порядка держанного при погребении блаженныя высокославныя и вечно достоинеишия памяти всепресветлеишаго державнеишаго Петра Великаго императора и самодержца всероссииского и блаженныя памяти Ея Императорского Высочества государыни цесаревны Наталии Петровны,https://www.prlib.ru/item/355087,0
1725,"Описание коронации е. в. имп. Екатерины Алексиевны, торжественно отправленной в царствующем граде Москве 7 маия 1724 году",https://www.prlib.ru/item/434720,0
1725,Его императорскаго величества Генеральный регламент или Устав,https://www.prlib.ru/item/408202,0
1726,Выводы метеорологических наблюдений производившиеся в Академии наук в.... [1726-1850 гг.],https://www.prlib.ru/item/903296,0
1726,"Копии его царского величества указов состоявшихся в 1719, и в 1720 годех",https://www.prlib.ru/item/420976,0
1727,Указ всем во флоте российском обретающымся вышним и нижним служителем православныя кафолическия веры.,https://www.prlib.ru/item/713104,0
1728,"1727 года. Блаженныя и вечнодостоиныя памяти ея императорского величества, Екатерины Алексиевны, состоявшияся указы по кончину ея величества. Такожде Манифест о принятии россииского престола, всепресветлеишаго державнеишаго великого государя, Петра Алексиевича Втораго, императора и самодержца всероссииского, и присяга в вернои службе его величеству, и публичныяж указы по нынешнеи 728 год",https://www.prlib.ru/item/394535,0
1728,"По указу его императорского величества. Наказ губернатором и воеводам, и их товарыщам, по которому они должны поступать",https://www.prlib.ru/item/437668,0
1728,"Устав о соляных промыслах, и о торгу оною, и о протчем.",https://www.prlib.ru/item/713131,0
1728,"Всепресветлеишаго, самодержавнеишаго, великаго государя Петра Алексиевича Втораго, императора и самодержца всероссийского указы и уставы",https://www.prlib.ru/item/405907,0
1729,"Всепресветлеишаго, самодержавнеишаго, великого государя Петра Алексиевича Втораго, императора и самодержца всероссииского указы 1728 года",https://www.prlib.ru/item/405908,0
1729,"A general History of the Turks, Moguls, and Tatars, vulgary called Tartars. Vol.2. An account of the present state of the Northern Asia, relating to the Natural History of Grand Tatary and Siberia : And the Manners, Customs, Trade, Laws, Religion and Polity of the different People inhabiting the same. Together with Some Observations concerning China, India, Persia, Arabia, Turky, and Great Russia",https://www.prlib.ru/item/1472707,0
1730,"A general History of the Turks, Moguls, and Tatars, vulgary called Tartars. Vol.1. The Genealogical History of the Tatars",https://www.prlib.ru/item/1472700,0
1730,"Описание коронации ея величества императрицы, и самодержицы всероссиискои, Анны Иоанновны, торжественно отправленнои в царствующем граде Москве, 28 апреля 1730 году",https://www.prlib.ru/item/434722,0
1731,"Обстоятельная реляция церемонеи с которыми прибывшее в Москву Хинеиское посолство тамо 21 дня генваря 1731 года принято, и потом 26 дня тогож месяца до аудиенции ведено",https://www.prlib.ru/item/713060,0
1731,Регламент о содержании Корпуса кадетского,https://www.prlib.ru/item/713046,0
1731,"Umstandliche Beschreibung der Hohen Salbung und Cronung der allerdurchlauchtigsten, grossmuchtigsten Furstin und grossen Fraunen, Anna Joannowna Kayserin und Selbstherrscherin von gantz Russland, ... wie solche den 28. Apr. 1730. in der Kayserl.",https://www.prlib.ru/item/316427,0
1731,[Регламент Камер-коллегии],https://www.prlib.ru/item/394483,0
1731,"Тариф портовои, 1731 года",https://www.prlib.ru/item/372725,0
1732,Мемории или Записки артиллерийския. Т. 1,https://www.prlib.ru/item/1089946,0
1732,"Инструкция (или устав) каким образом потребные для содержания Ея Императорского Величества флотов леса где заказаны и порядочно готовлены и рублены быть имеют, и как в бережении их поступать.",https://www.prlib.ru/item/686652,0
1733,Регламент или Инструкция Ревизион колегии,https://www.prlib.ru/item/910697,0
1733,"Копии с состоявшихся блаженныя и вечнодостоиныя памяти, его императорского величества, Петра Перваго, императора и самодержца всероссийского указов, 1719, 1720, и 1721 годов, в народ публикованных, и с вечного мирного трактату с Свеискою короною, в прежних книгах напечатанных",https://www.prlib.ru/item/420985,0
1734,"[Журнал Придворной конторы... на знатные при дворе ее императорского величества оказании]. ... 1734 году. [За первый год из находящихся в Придворной Конторе журналов времени царствования Императрицы Анны Иоанновны, с оставлением правил правописания ошибок подлинника]",https://www.prlib.ru/item/806324,0
1735,Его императорскаго величества Генеральныи регламент или Устав,https://www.prlib.ru/item/408201,0
1735,"Трактат о дружбе и коммерции, между Российскою империею и короною Великобританскою",https://www.prlib.ru/item/375715,1
1735,"Церемониал отпускнои аудиэнции, которую депутаты города Гданска при россииском имераторском дворе маия 16 дня 1735 года имели",https://www.prlib.ru/item/903469,0
1735,Артикул воинский,https://www.prlib.ru/item/713785,0
1736,"О порядке в содержании приходов и росходов, и счетов о денгах, и каким образом книги весть и в том поступать надлежит: в губерниях, правинциях, и городех",https://www.prlib.ru/item/714342,0
1736,"Копия с письма, отправленнаго по указу ея императорскаго величества самодержицы всероссийской от кабинетнаго министра вицеканцлера и орденов всероссийских кавалера графа Остермана к турецкому верховному везирю апреля 12 дня, 1736 года.",https://www.prlib.ru/item/712854,0
1737,"Копии с указов блаженныя и вечнодостоиныя памяти, его императорскаго величества, Петра Перваго, императора и самодержца всероссийскаго на 1723 год состоявшихся",https://www.prlib.ru/item/420987,0
1737,"Копии с указов блаженныя и вечнодостоиныя памяти, его императорскаго величества, Петра Перваго, императора и самодержца всероссиискаго в 1722 году состоявшихся.",https://www.prlib.ru/item/420986,0
1738,"Копии с указов, блаженныя и вечнодостоиныя памяти, его императорскаго величества, Петра Перваго, императора и самодержца всероссиискаго, с 1714. по 1722: год состоявшихся.",https://www.prlib.ru/item/1672164,0
1739,"Указы блаженныя и вечнодостоиныя памяти государя императора Петра Великаго самодержца всероссиискаго, состоявшияся с 1714, по кончину его императорскаго величества, генваря по 28 число, 1725 году",https://www.prlib.ru/item/459706,0
1739,[Берг-регламент],https://www.prlib.ru/item/713207,0
1740,"Регламент о управлении Адмиралтеиства и Верфи и о должностях Коллегии адмиралтеискои, и протчих всех чинов при Адмира[л]теистве обретающихся. [Ч. 1]",https://www.prlib.ru/item/441900,0
1740,"Регламент о управлении Адмиралтеиства и Верфи и о должностях Коллегии адмиралтеискои, и протчих всех чинов при Адмира[л]теистве обретающихся. Ч. 2. Часть вторая Регламента морскаго в которои определено о всем что касается добраго управления в бытность флота в порте також о содержании портов и реидов.",https://www.prlib.ru/item/441901,0
1741,"Описание церемониала с коротым его имп. величества чрезвычайный и полномочный посол господин генерал Румянцов в Константинополе свой торжественный въезд имел и сперьва у веръховнаго везиря на визите, а потом у турецкаго султана на публичной аудиэнции был",https://www.prlib.ru/item/910698,0
1741,"Палаты Санкт-Петербургской Императорской Академии наук, библиотеки и кунсткамеры, которых представлены планы, фасады и профили",https://www.prlib.ru/item/687743,0
1741,Палаты Санктпетербургской Императорской Академии наук Библиотеки и Кунсткамеры,https://www.prlib.ru/item/436210,0
1741,"Копия с трактату вечного, заключенного между России, и Дании о салютации флотов, эскадр, кораблеи, и крепостеи данного с россиискои стороны.",https://www.prlib.ru/item/714341,0
1741,Московская или Российская гистория от времяни Как из российских разных княжениев едино великое государство простираетца даже до утвержденного мира в Столбове со шведы 1617 года оной инструмент или Гистория сочинена непохлебствуя никому,https://www.prlib.ru/item/959106,0
1741,"Подлинное и обстоятельное описание построенного в Санкт-Петербурге в январе месяце 1740 года Ледяного Дома и всех находившихся в нем домовых вещей и уборов с приложенными при том гридорованными фигурами, также и некоторыми примечаниями о бывшей в 1740 году во всей Европе жестокой стуже",https://www.prlib.ru/item/358103,0
1742,"Генеральныя сигналы для надзирания, когда оба флота ея имп. величества то есть карабельнои, и галернои, купно в компании будут.",https://www.prlib.ru/item/713064,0
1742,"Инструкция и сигналы, которыя надлежит обсервовать во время бою",https://www.prlib.ru/item/713067,0
1742,Генеральныя сигналы для надзирания в российском карабельном флоте ея имп. величества,https://www.prlib.ru/item/713063,0
1743,Указы блаженныя и вечнодостойныя памяти великой государыни императрицы Екатерины Алексиевны и государя императора Петра Втораго,https://www.prlib.ru/item/459707,0
1743,"Манифест о разных преимуществах, предоставляемых магометанам за восприятие грекороссийского исповедания",https://www.prlib.ru/item/426749,0
